{
  "schema_version": "1.0.0",
  "plan_id": "PLAN_006",
  "artifact_id": "PLAN_006_T2-B",
  "mission_id": "PLAN_006_T2_B_PROPORTIONAL_VERIFICATION",
  "increment": "T2-B",
  "repository_revision": "26113dec1fd2d3cdfa1ee0056b3d977c11163039+WORKTREE_UNCOMMITTED",
  "generated_at": "2026-08-14T18:43:31.207361Z",
  "source_inputs": [
    {
      "path": "plans/001_CONTROL_OPERATIVO.md",
      "sha256": "671a65e496390ba8a63d49516e4feaf23978e2a00e63bfb647ac7025bb977e64"
    },
    {
      "path": "plans/plan_006/006_LEAN_HARNESS_ASSURANCE_ORQUESTACION_EFICIENCIA.md",
      "sha256": "89dd47ced238900663617d172e0221b1764eef53ea139ae6afa7a08fecd0b8ae"
    },
    {
      "path": "src/core/proportional_verification.py",
      "sha256": "0dd68aa5ad993878a0d37d6ab13fca65982101979951feb5ec24602a17b6a3fe"
    },
    {
      "path": "tests/core/test_plan_006_t2b_proportional_verification.py",
      "sha256": "c24e71201821be87ccfa4b6e19f58ce7e79cec5a570e88a50b633dd24d031014"
    }
  ],
  "evidence_refs": [
    "plans/001_CONTROL_OPERATIVO.md",
    "plans/plan_006/006_LEAN_HARNESS_ASSURANCE_ORQUESTACION_EFICIENCIA.md",
    "src/core/proportional_verification.py",
    "tests/core/test_plan_006_t2b_proportional_verification.py"
  ],
  "limitations": [],
  "result": "PASS",
  "metrics": {
    "mission_wall_time": "NOT_OBSERVABLE",
    "commands_executed": 1,
    "unique_tests_or_test_groups_executed": 7,
    "tests_repeated_equivalently": 0,
    "full_suite_runs": 0,
    "targeted_suite_runs": 1,
    "gates_executed": 0,
    "resolved_context_size": "NOT_OBSERVABLE",
    "estimated_tokens_method": "UTF8_BYTES_DIVIDED_BY_4",
    "context_references_count": 4,
    "context_expansions": 0,
    "delegation_decision": "INLINE",
    "findings_before_completion": 1,
    "findings_after_completion": 0,
    "false_convergence_events": 0,
    "initial_head": "29b5218778f045b17f2b4c9d456e0b2457c46be8",
    "final_head": "29b5218778f045b17f2b4c9d456e0b2457c46be8",
    "actual_git_diff_files": 2,
    "staged_files": 0,
    "commit_count": 0
  },
  "phases": {
    "context_discovery": {
      "present": true
    },
    "planning_reasoning": {
      "present": true
    },
    "implementation": {
      "present": true
    },
    "deterministic_validation": {
      "present": true
    },
    "independent_review": {
      "status": "PENDING"
    },
    "repair": {
      "iterations": 0
    },
    "revalidation": {
      "present": true
    },
    "git_operations": {
      "status": "PENDING"
    }
  },
  "measurement_contracts": [
    {
      "metric": "verification_plan_step",
      "baseline": "DIRECT_IMPACT -> TARGETED_SUITE",
      "comparison_unit": "step",
      "capture_method": "build_verification_plan",
      "observability": "MEASURED",
      "decision_rule": "escalar solo si material_dependency != NO_MATERIAL_IMPACT",
      "evidence_reference": "reports/implementation/plan_006/T2_B_PROPORTIONAL_VERIFICATION.json"
    }
  ],
  "authority": {
    "live_state_path": "plans/001_CONTROL_OPERATIVO.md"
  },
  "evidence_identity_sha256": "134ad93cdf81ba5de7cd70bbd3a347c7cebe77ca23f6ecc2548c87fec94f1d69"
}
