{
  "schema_version": "1.0.0",
  "plan_id": "PLAN_006",
  "artifact_id": "PLAN_006_T4-0",
  "mission_id": "PLAN_006_T4_0_GAP_ANALYSIS",
  "increment": "T4-0",
  "repository_revision": "03234e934b12d1bbaebd022d52bd69303c352af1+WORKTREE_UNCOMMITTED",
  "generated_at": "2026-08-13T21:59:58.661374Z",
  "source_inputs": [
    {
      "path": "plans/001_CONTROL_OPERATIVO.md",
      "sha256": "f55d8f774e5d3a66bd52425a8c8469430d6151394f08b350e359a44e68a81129"
    },
    {
      "path": "plans/plan_006/006_LEAN_HARNESS_ASSURANCE_ORQUESTACION_EFICIENCIA.md",
      "sha256": "89dd47ced238900663617d172e0221b1764eef53ea139ae6afa7a08fecd0b8ae"
    },
    {
      "path": "src/core/gap_analysis.py",
      "sha256": "2bc4d6bf4c5abd841bb3c75793377a677c64fa962e1182c260bec9ddbbff2def"
    },
    {
      "path": "config/delegation_policy.json",
      "sha256": "03478475129e2b39c4ecf7d97895ef39e23c6ec798a17071e4b5f2ffb0c09942"
    },
    {
      "path": "config/agent_execution_profiles.json",
      "sha256": "6f1809d92fc658a8c5f5afe1946fd85328fab24c7da2cdc753a78d48bf9fc6ff"
    },
    {
      "path": "src/core/routing_policy.py",
      "sha256": "b33d5dc43e0e806e376780933c910c01d140726c2ac6bf5d2a6e08b1e465ae9f"
    },
    {
      "path": "src/core/context_resolution.py",
      "sha256": "d7e122171dc44ca2a415c90207e478042d5a38e10d23bbff2cbb52f383e90a8b"
    },
    {
      "path": "src/core/review_workload.py",
      "sha256": "bf1ab5b69fdc2f33407ad95ac22f3331084daad7b5e5a3667705d9036ce78db6"
    },
    {
      "path": "src/core/mission_authorization.py",
      "sha256": "603ed482fe0d4c1d8bbe0333fcbbc768115975cf814e99e8a4c3e992a23cbbde"
    }
  ],
  "evidence_refs": [
    "plans/001_CONTROL_OPERATIVO.md",
    "plans/plan_006/006_LEAN_HARNESS_ASSURANCE_ORQUESTACION_EFICIENCIA.md",
    "src/core/gap_analysis.py",
    "config/delegation_policy.json",
    "config/agent_execution_profiles.json",
    "src/core/routing_policy.py",
    "src/core/context_resolution.py",
    "src/core/review_workload.py",
    "src/core/mission_authorization.py"
  ],
  "limitations": [],
  "result": "PASS",
  "metrics": {
    "mission_wall_time": "NOT_OBSERVABLE",
    "commands_executed": 2,
    "unique_tests_or_test_groups_executed": 13,
    "tests_repeated_equivalently": 0,
    "full_suite_runs": 0,
    "targeted_suite_runs": 1,
    "gates_executed": 0,
    "resolved_context_size": "NOT_OBSERVABLE",
    "estimated_tokens_method": "UTF8_BYTES_DIVIDED_BY_4",
    "context_references_count": 6,
    "context_expansions": 0,
    "delegation_decision": "INLINE",
    "findings_before_completion": 0,
    "findings_after_completion": 0,
    "false_convergence_events": 0,
    "initial_head": "29b5218778f045b17f2b4c9d456e0b2457c46be8",
    "final_head": "29b5218778f045b17f2b4c9d456e0b2457c46be8",
    "actual_git_diff_files": 2,
    "staged_files": 0,
    "commit_count": 0,
    "needs_analyzed": 7,
    "real_gap_count": 0,
    "partially_covered_count": 3,
    "gap_findings_json": "[{\"classification\": \"ALREADY_COVERED\", \"evidence_path\": \"config/delegation_policy.json\", \"existing_capability\": \"delegation_policy\", \"need\": \"DECISION_INLINE_DELEGATE_ESCALATE\", \"reason\": \"SEMANTIC_SURFACE_PRESENT_AND_CANONICAL\"}, {\"classification\": \"ALREADY_COVERED\", \"evidence_path\": \"src/core/mission_authorization.py\", \"existing_capability\": \"mission_authorization\", \"need\": \"DELEGATION_BOUNDED_BY_AUTHORIZATION\", \"reason\": \"SEMANTIC_SURFACE_PRESENT_AND_CANONICAL\"}, {\"classification\": \"ALREADY_COVERED\", \"evidence_path\": \"src/core/review_workload.py\", \"existing_capability\": \"review_workload\", \"need\": \"REVIEW_FLOOR\", \"reason\": \"SEMANTIC_SURFACE_PRESENT_AND_CANONICAL\"}, {\"classification\": \"ALREADY_COVERED\", \"evidence_path\": \"src/core/routing_policy.py\", \"existing_capability\": \"routing_policy\", \"need\": \"ROUTING_WITHIN_AUTHORIZED_CANDIDATE_SET\", \"reason\": \"SEMANTIC_SURFACE_PRESENT_AND_CANONICAL\"}, {\"classification\": \"PARTIALLY_COVERED\", \"evidence_path\": \"config/agent_execution_profiles.json\", \"existing_capability\": \"agent_execution_profiles\", \"need\": \"LOWEST_SUFFICIENT_ROUTE\", \"reason\": \"SEMANTIC_SURFACE_PRESENT_AND_CANONICAL\"}, {\"classification\": \"PARTIALLY_COVERED\", \"evidence_path\": \"src/core/context_resolution.py\", \"existing_capability\": \"context_resolution\", \"need\": \"CONTEXT_BUDGET\", \"reason\": \"SEMANTIC_SURFACE_PRESENT_AND_CANONICAL\"}, {\"classification\": \"PARTIALLY_COVERED\", \"evidence_path\": \"src/core/routing_policy.py\", \"existing_capability\": \"routing_policy\", \"need\": \"VERIFICATION_BUDGET\", \"reason\": \"SEMANTIC_SURFACE_PRESENT_AND_CANONICAL\"}]",
    "real_gaps_json": "[]"
  },
  "phases": {
    "context_discovery": {
      "present": true
    },
    "planning_reasoning": {
      "present": true
    },
    "implementation": {
      "present": true
    },
    "deterministic_validation": {
      "present": true
    },
    "independent_review": {
      "status": "PENDING"
    },
    "repair": {
      "iterations": 0
    },
    "revalidation": {
      "present": true
    },
    "git_operations": {
      "status": "PENDING"
    }
  },
  "measurement_contracts": [
    {
      "metric": "gap_classification",
      "baseline": "ALREADY_COVERED / PARTIALLY_COVERED / REAL_GAP with surface evidence",
      "comparison_unit": "need",
      "capture_method": "run_gap_analysis + analyze_gaps against live surfaces",
      "observability": "MEASURED",
      "decision_rule": "implement only REAL_GAP with minimum change and evidence",
      "evidence_reference": "reports/implementation/plan_006/T4_0_GAP_ANALYSIS.json"
    }
  ],
  "authority": {
    "live_state_path": "plans/001_CONTROL_OPERATIVO.md"
  },
  "evidence_identity_sha256": "b0f7cdb4b57443c4d84b596e2d0c64c67d8585fec29c1b61c425a68c6394db4d"
}
