{
  "schema_version": "1.0.0",
  "plan_id": "PLAN_006",
  "artifact_id": "PLAN_006_T5",
  "mission_id": "PLAN_006_T5_MEASURED_OPENCODE_PILOT",
  "increment": "T5",
  "repository_revision": "03234e934b12d1bbaebd022d52bd69303c352af1+WORKTREE_UNCOMMITTED",
  "generated_at": "2026-08-13T21:59:43.361821Z",
  "source_inputs": [
    {
      "path": "plans/001_CONTROL_OPERATIVO.md",
      "sha256": "f55d8f774e5d3a66bd52425a8c8469430d6151394f08b350e359a44e68a81129"
    },
    {
      "path": "plans/plan_006/PLAN_006_T5_AUTHORIZATION.json",
      "sha256": "8ddaf5ccaa5801cf5b581197b937be47642ef924f95ebc6b34b39ce7fa949cf7"
    },
    {
      "path": "plans/plan_006/PLAN_006_T5_AUTHORITY.json",
      "sha256": "524b3af4e8b25e8dc29cc0b5d7f79846ec6386dd1d84a6f21012d3df03ee1021"
    },
    {
      "path": "src/core/plan_006_closure_check.py",
      "sha256": "b4a5f5973a9d829f4bff2af59044a6a6d406446f692d1a06aee7d2c212cbdd05"
    },
    {
      "path": "tests/core/test_plan_006_t5_closure_check.py",
      "sha256": "c662252483a27ba0fe4222ec6d253a319c898fb7976a783bc9a7e5d3422d84c7"
    }
  ],
  "evidence_refs": [
    "plans/001_CONTROL_OPERATIVO.md",
    "plans/plan_006/PLAN_006_T5_AUTHORIZATION.json",
    "plans/plan_006/PLAN_006_T5_AUTHORITY.json",
    "src/core/plan_006_closure_check.py",
    "tests/core/test_plan_006_t5_closure_check.py"
  ],
  "limitations": [
    "Pilot scoped to T5; DELEGATE validity ends with T5; no persistent agents or agent catalogs created",
    "wall_time/context sizes recorded NOT_OBSERVABLE (harness does not surface them deterministically)"
  ],
  "result": "PASS",
  "metrics": {
    "mission_wall_time": "NOT_OBSERVABLE",
    "commands_executed": 4,
    "unique_tests_or_test_groups_executed": 7,
    "tests_repeated_equivalently": 0,
    "full_suite_runs": 0,
    "targeted_suite_runs": 2,
    "gates_executed": 0,
    "resolved_context_size": "NOT_OBSERVABLE",
    "estimated_tokens_method": "UTF8_BYTES_DIVIDED_BY_4",
    "context_references_count": 8,
    "context_expansions": 0,
    "delegation_decision": "DELEGATE",
    "additional_actors_used": 2,
    "delegated_context_size": "NOT_OBSERVABLE",
    "delegation_overhead": "NOT_OBSERVABLE",
    "parallel_or_sequential": "PARALLEL",
    "repair_iterations": 2,
    "revalidation_iterations": 2,
    "findings_before_completion": 3,
    "findings_after_completion": 0,
    "false_convergence_events": 0,
    "initial_head": "29b5218778f045b17f2b4c9d456e0b2457c46be8",
    "final_head": "29b5218778f045b17f2b4c9d456e0b2457c46be8",
    "actual_git_diff_files": 3,
    "staged_files": 0,
    "commit_count": 0
  },
  "phases": {
    "context_discovery": {
      "present": true,
      "delegated": true
    },
    "planning_reasoning": {
      "present": true
    },
    "implementation": {
      "present": true,
      "topology": "PRIMARY"
    },
    "deterministic_validation": {
      "present": true
    },
    "independent_review": {
      "status": "PENDING"
    },
    "repair": {
      "iterations": 2
    },
    "revalidation": {
      "present": true
    },
    "git_operations": {
      "status": "PENDING"
    }
  },
  "measurement_contracts": [
    {
      "metric": "delegation_decision",
      "baseline": "INLINE/DELEGATE/ESCALATE bounded by T5 authorization",
      "comparison_unit": "decision",
      "capture_method": "measured pilot: 2 temporary explore subagents in parallel, primary implementation, depth 1",
      "observability": "MEASURED",
      "decision_rule": "DELEGATE valid only inside T5 pilot; ends with T5; no persistent agents; no functional authority",
      "evidence_reference": "reports/implementation/plan_006/T5_PILOT.json"
    },
    {
      "metric": "pilot_topology",
      "baseline": "temporary subagents decided dynamically by orchestrator",
      "comparison_unit": "topology",
      "capture_method": "OpenCode native Task/explore/general; no .opencode/agents/* created",
      "observability": "MEASURED",
      "decision_rule": "max depth 1; parallel only for independent discovery; review independent",
      "evidence_reference": "reports/implementation/plan_006/T5_PILOT.json"
    }
  ],
  "authority": {
    "live_state_path": "plans/001_CONTROL_OPERATIVO.md"
  },
  "evidence_identity_sha256": "40e5d307306020a883339a5dd326004ad06526d36b4fbfe2d63a8766f0604bf6"
}
