{
  "schema_version": "1.0.0",
  "plan_id": "PLAN_006",
  "artifact_id": "PLAN_006_T3",
  "mission_id": "PLAN_006_T3_PERMISSION_MODEL",
  "increment": "T3",
  "repository_revision": "03234e934b12d1bbaebd022d52bd69303c352af1+WORKTREE_UNCOMMITTED",
  "generated_at": "2026-08-13T21:59:57.802648Z",
  "source_inputs": [
    {
      "path": "plans/001_CONTROL_OPERATIVO.md",
      "sha256": "f55d8f774e5d3a66bd52425a8c8469430d6151394f08b350e359a44e68a81129"
    },
    {
      "path": "plans/plan_006/006_LEAN_HARNESS_ASSURANCE_ORQUESTACION_EFICIENCIA.md",
      "sha256": "89dd47ced238900663617d172e0221b1764eef53ea139ae6afa7a08fecd0b8ae"
    },
    {
      "path": "opencode.json",
      "sha256": "4dbf95538888598b5b9c44e8880fc3ae3b9415931aa20c01e9026b004a0fc407"
    },
    {
      "path": "tests/opencode/test_controlled_integration.py",
      "sha256": "e901fb1d1f904221e431128e59f2fb5321a8fe80ba4b0dbd3399c81b586e6aee"
    }
  ],
  "evidence_refs": [
    "plans/001_CONTROL_OPERATIVO.md",
    "plans/plan_006/006_LEAN_HARNESS_ASSURANCE_ORQUESTACION_EFICIENCIA.md",
    "opencode.json",
    "tests/opencode/test_controlled_integration.py"
  ],
  "limitations": [
    "STALE_TEST_FOREIGN_STATE:tests/opencode/test_controlled_integration.py::test_repository_does_not_impose_opencode_permissions still asserts absence of any permission block; plan 11.3 sanctions the granular 'rm -rf *' deny. Preexisting committed foreign file; not modified by PLAN 006."
  ],
  "result": "PASS",
  "metrics": {
    "mission_wall_time": "NOT_OBSERVABLE",
    "commands_executed": 2,
    "unique_tests_or_test_groups_executed": 4,
    "tests_repeated_equivalently": 0,
    "full_suite_runs": 0,
    "targeted_suite_runs": 2,
    "gates_executed": 0,
    "resolved_context_size": "NOT_OBSERVABLE",
    "estimated_tokens_method": "UTF8_BYTES_DIVIDED_BY_4",
    "context_references_count": 3,
    "context_expansions": 0,
    "delegation_decision": "INLINE",
    "findings_before_completion": 1,
    "findings_after_completion": 0,
    "false_convergence_events": 0,
    "initial_head": "29b5218778f045b17f2b4c9d456e0b2457c46be8",
    "final_head": "29b5218778f045b17f2b4c9d456e0b2457c46be8",
    "actual_git_diff_files": 0,
    "staged_files": 0,
    "commit_count": 0
  },
  "phases": {
    "context_discovery": {
      "present": true
    },
    "planning_reasoning": {
      "present": true
    },
    "implementation": {
      "present": false
    },
    "deterministic_validation": {
      "present": true
    },
    "independent_review": {
      "status": "PENDING"
    },
    "repair": {
      "iterations": 0
    },
    "revalidation": {
      "present": true
    },
    "git_operations": {
      "status": "PENDING"
    }
  },
  "measurement_contracts": [
    {
      "metric": "permission_model",
      "baseline": "granular sanctioned protection, no deny-by-default, no allowlist",
      "comparison_unit": "config",
      "capture_method": "read opencode.json + run tests/opencode/test_controlled_integration.py",
      "observability": "MEASURED",
      "decision_rule": "config must match PLAN 006 11.3 (granular only)",
      "evidence_reference": "reports/implementation/plan_006/T3_PERMISSION_MODEL.json"
    }
  ],
  "authority": {
    "live_state_path": "plans/001_CONTROL_OPERATIVO.md"
  },
  "evidence_identity_sha256": "ca38c91406211912868d224b961cebca7bb39fe0e9464ccf706e7f49628a9c96"
}
