{
  "schema_version": "1.0.0",
  "plan_id": "PLAN_006",
  "artifact_id": "PLAN_006_T2-D",
  "mission_id": "PLAN_006_T2_D_CONTEXT_OUTPUT_ECONOMY",
  "increment": "T2-D",
  "repository_revision": "52513b66f122648ae1fd9ce5d8a756faf898a26a+WORKTREE_UNCOMMITTED",
  "generated_at": "2026-08-13T14:10:50.341871Z",
  "source_inputs": [
    {
      "path": "plans/001_CONTROL_OPERATIVO.md",
      "sha256": "98a07099d1b8d0556aba631c416ced12708138bb8007f6d7e4251a8924512c25"
    },
    {
      "path": "plans/plan_006/006_LEAN_HARNESS_ASSURANCE_ORQUESTACION_EFICIENCIA.md",
      "sha256": "d6d009dd1a191fbf9e2f984e97a31b51fb4de0e0f744229e1b3734482e6a21f1"
    },
    {
      "path": "src/core/context_output_economy.py",
      "sha256": "39fc932715ad35ddf9304e2d7f606e54f2c8d78c1fd303161d1d936d2c864bfc"
    },
    {
      "path": "tests/core/test_plan_006_t2d_context_output_economy.py",
      "sha256": "39435b9a5626744d035e46f8111bc233f0508d74796f92527f0498b80952e251"
    }
  ],
  "evidence_refs": [
    "plans/001_CONTROL_OPERATIVO.md",
    "plans/plan_006/006_LEAN_HARNESS_ASSURANCE_ORQUESTACION_EFICIENCIA.md",
    "src/core/context_output_economy.py",
    "tests/core/test_plan_006_t2d_context_output_economy.py"
  ],
  "limitations": [],
  "result": "PASS",
  "metrics": {
    "mission_wall_time": "NOT_OBSERVABLE",
    "commands_executed": 2,
    "unique_tests_or_test_groups_executed": 14,
    "tests_repeated_equivalently": 0,
    "full_suite_runs": 0,
    "targeted_suite_runs": 2,
    "gates_executed": 0,
    "resolved_context_size": "NOT_OBSERVABLE",
    "estimated_tokens_method": "UTF8_BYTES_DIVIDED_BY_4",
    "context_references_count": 4,
    "context_expansions": 0,
    "delegation_decision": "INLINE",
    "findings_before_completion": 1,
    "findings_after_completion": 0,
    "false_convergence_events": 0,
    "initial_head": "29b5218778f045b17f2b4c9d456e0b2457c46be8",
    "final_head": "29b5218778f045b17f2b4c9d456e0b2457c46be8",
    "actual_git_diff_files": 2,
    "staged_files": 0,
    "commit_count": 0
  },
  "phases": {
    "context_discovery": {
      "present": true
    },
    "planning_reasoning": {
      "present": true
    },
    "implementation": {
      "present": true
    },
    "deterministic_validation": {
      "present": true
    },
    "independent_review": {
      "status": "PENDING"
    },
    "repair": {
      "iterations": 0
    },
    "revalidation": {
      "present": true
    },
    "git_operations": {
      "status": "PENDING"
    }
  },
  "measurement_contracts": [
    {
      "metric": "product_impact_check",
      "baseline": "touched surface -> known consumers -> targeted regression",
      "comparison_unit": "surface",
      "capture_method": "run_product_impact_check",
      "observability": "MEASURED",
      "decision_rule": "fail-closed si NO_KNOWN_CONSUMERS",
      "evidence_reference": "reports/implementation/plan_006/T2_D_CONTEXT_OUTPUT_ECONOMY.json"
    }
  ],
  "authority": {
    "live_state_path": "plans/001_CONTROL_OPERATIVO.md"
  },
  "evidence_identity_sha256": "4b8547296aee7f4fcf8a3e637fb486693791c54d385c4465506b59d224ace8bc"
}
